{
  "@context": [
    "https://www.w3.org/ns/credentials/v2",
    "https://trustgraph.net/ns/v1"
  ],
  "type": [
    "VerifiableCredential",
    "TrustAtomCredential"
  ],
  "issuer": "did:key:z6MkrJVnaZkeFzdQyMZu1cgjg7k1pZZ6pvBQ7XJPt4swbTQ2",
  "validFrom": "2026-10-08T12:00:00Z",
  "credentialSubject": {
    "id": "https://sushi.example"
  },
  "proof": {
    "type": "DataIntegrityProof",
    "cryptosuite": "eddsa-jcs-2022",
    "created": "2026-10-08T12:00:00Z",
    "verificationMethod": "did:key:z6MkrJVnaZkeFzdQyMZu1cgjg7k1pZZ6pvBQ7XJPt4swbTQ2#z6MkrJVnaZkeFzdQyMZu1cgjg7k1pZZ6pvBQ7XJPt4swbTQ2",
    "proofPurpose": "assertionMethod",
    "@context": [
      "https://www.w3.org/ns/credentials/v2",
      "https://trustgraph.net/ns/v1"
    ],
    "proofValue": "z5PGV6YmpGvsApgFRH1qo4BcCnptn52bU2Lb3pUKy65SuAsgTbZwa7J8M7ZwamXwCL8aaWS9hGS4irwfGYQV4ZgaU"
  }
}
