{
  "@context": [
    "https://www.w3.org/ns/credentials/v2",
    "https://trustgraph.net/ns/v1"
  ],
  "type": [
    "VerifiableCredential",
    "TrustAtomCredential"
  ],
  "issuer": "did:key:z6MkrJVnaZkeFzdQyMZu1cgjg7k1pZZ6pvBQ7XJPt4swbTQ2",
  "validFrom": "2026-10-09T08:30:00Z",
  "credentialSubject": {
    "id": "did:web:alice.example",
    "content": "https://schema.org/Review",
    "value": "-0.25",
    "replaces": "ipfs://bafkreidni6r6c2l23ssdh74k2ld465hr7rxhb2cwr2w6lcerwb62sydine"
  },
  "proof": {
    "type": "DataIntegrityProof",
    "cryptosuite": "eddsa-jcs-2022",
    "created": "2026-10-09T08:30:00Z",
    "verificationMethod": "did:key:z6MkrJVnaZkeFzdQyMZu1cgjg7k1pZZ6pvBQ7XJPt4swbTQ2#z6MkrJVnaZkeFzdQyMZu1cgjg7k1pZZ6pvBQ7XJPt4swbTQ2",
    "proofPurpose": "assertionMethod",
    "@context": [
      "https://www.w3.org/ns/credentials/v2",
      "https://trustgraph.net/ns/v1"
    ],
    "proofValue": "z5a9msXxM7ufJdSRb3JKgK4HA4hWTNpFoVArbbVEkx4FuZh2uuUXfPCgNswH9uEac6cmGGMSpV9qJ7xrEDfcxYQEz"
  }
}
