{
  "@context": [
    "https://www.w3.org/ns/credentials/v2",
    "https://trustgraph.net/ns/v1"
  ],
  "type": [
    "VerifiableCredential",
    "TrustAtomCredential"
  ],
  "issuer": "did:key:z6MkrJVnaZkeFzdQyMZu1cgjg7k1pZZ6pvBQ7XJPt4swbTQ2",
  "validFrom": "2026-10-08T12:00:00Z",
  "credentialSubject": {
    "id": "did:web:alice.example",
    "content": "rust code review",
    "value": "0.8",
    "extra": {
      "via": "meetup"
    }
  }
}
